Line_Number,Dominant_Topic_Number,Sentences,Keywords_In_Dominant_Topic
171,0,"Maybe if we start with educating the kids in schools then getting the parents involved that do not know the difference, so by the time the kids are adults they will hopefully be able to teach their kids the difference between the two","school, healthy, food, class, student, job, teach, state, high_school, emergency"
138,0,Maybe starting when kids are in middle school and having not just a powerpoint lesson but instead a discussion on what could be done and how to prevent health risk and becoming pregnant at a young age,"school, healthy, food, class, student, job, teach, state, high_school, emergency"
1181,0,"There should also be some activities that aren't sport based. Not all students have the time to dedicate themselves to too many things so maybe something like a P.E. class with a certain emphasis can be created. For example, a swimming class but necessarily doing things as part of a team like a water aerobics class.","school, healthy, food, class, student, job, teach, state, high_school, emergency"
1182,0,"Healthier foods should be enforced in restaurants, especially fast food. Even though most establish a low calorie menu, it still is not necessarily good to eat. So I think there should be a bigger push in that direction to help health","school, healthy, food, class, student, job, teach, state, high_school, emergency"
1183,0,"Agreed. There should be more than one healthy option at each fast food restaurant. Or maybe, there should be a fast food chain dedicated directly to healthier option like Snappy Salads.","school, healthy, food, class, student, job, teach, state, high_school, emergency"
777,0,"Stop telling people to use mouthwash, all it does is make your mouth burn. It does not clean teeth, nor does it make your breath smell good for more than a hour. Just brush your teeth and floss, that's all you need.","school, healthy, food, class, student, job, teach, state, high_school, emergency"
437,0,schools should have some type of first aid and educational session for students,"school, healthy, food, class, student, job, teach, state, high_school, emergency"
1184,0,"Agreed. A lot of students would much rather eat a bag of chips and a coke for lunch than eat the cafeteria food being served to the rest of the student body because the food is not remotely healthy. Healthier options should be given instead of cheesy, greasy foods.","school, healthy, food, class, student, job, teach, state, high_school, emergency"
1379,0,"School lunches have improved dramatically. There used to be chips, sodas, and jello. I'm not saying the food is perfect now, but there could be more salads and a wider variety of fruit to be thrown in.","school, healthy, food, class, student, job, teach, state, high_school, emergency"
1185,0,All school levels should require PE for every year of school from elementary until high school. Those playing sports could take another class separate from the rest of the students to practice on that sport and not intimidate those who are not equally as well.,"school, healthy, food, class, student, job, teach, state, high_school, emergency"
1180,0,"School districts need to learn how to budget. In most cases, other programs get greater funding. Like in some schools, more money might go towards the football department instead of the math department. They need to figure out what is more beneficial for the majority of students and budget around that.","school, healthy, food, class, student, job, teach, state, high_school, emergency"
1378,0,If a child is considered obese to due the fitness gram there should be a bigger input from the school to allow a lifestyle change. maybe a one on one with the parent and changing eating habits and exercise routines.,"school, healthy, food, class, student, job, teach, state, high_school, emergency"
1376,0,"There are already fitness grams at school to determine whether or not a child is considered obese, but instead of one a school year the school should follow up with a couple more times to see improvement.","school, healthy, food, class, student, job, teach, state, high_school, emergency"
157,0,"A lot of the times, guidance counselors are not in touch with the girls at school about anything. Students need someone who will talk to them openly about safe sex, birth control, etc. Make the topic an open discussion and a not a taboo subject that is discussed only after the girl gets pregnant.","school, healthy, food, class, student, job, teach, state, high_school, emergency"
581,0,Education programs should more state linked than diverse from state to state.,"school, healthy, food, class, student, job, teach, state, high_school, emergency"
445,0,"i love this, but multiple states of all sizes and types to eliminate bias","school, healthy, food, class, student, job, teach, state, high_school, emergency"
447,0,loosen restrictions on certain over-the-counter drugs,"school, healthy, food, class, student, job, teach, state, high_school, emergency"
1012,0,Nursing-intended students and physician-intended student go to school for a very long time to achieve a degree. Classes for them should be less-expensive.,"school, healthy, food, class, student, job, teach, state, high_school, emergency"
169,0,Maybe in each school district have a school that provides daycare and while the teen is still in school.,"school, healthy, food, class, student, job, teach, state, high_school, emergency"
170,0,Also have a guidance counselors for boys so they will know how to practice safe sex if chooses and let them be aware that sleeping with multiple partners could lead to risk of STDs and other things,"school, healthy, food, class, student, job, teach, state, high_school, emergency"
1845,0,make the class a state requirement,"school, healthy, food, class, student, job, teach, state, high_school, emergency"
782,0,"Start injecting a substance that turns bone into metal, yet still has the same effect as normal bones. That way, impossible to break your bone.","school, healthy, food, class, student, job, teach, state, high_school, emergency"
796,0,"Lets try to get ourselves into a good shape. Eating healthy, going to the gym, outdoor sports. If the government can put some camps up throughout the year; it would be helpful.","school, healthy, food, class, student, job, teach, state, high_school, emergency"
1027,0,Very true. Students need to learn early so that they can build up their ideas and their opinions for when they can have a choice.,"school, healthy, food, class, student, job, teach, state, high_school, emergency"
875,0,"everyone should be able to maintain a healthy diet so that they will not risk heart disease, obesity, high blood pressure, etc.","school, healthy, food, class, student, job, teach, state, high_school, emergency"
1049,0,"of course they first learn in the home, but some children eat 2 meals at school so having healthy and nutritious food to give them will be better for everybody.","school, healthy, food, class, student, job, teach, state, high_school, emergency"
414,0,educate the youth on how much their parents/guardians pay for them to stay healthy. education in schools,"school, healthy, food, class, student, job, teach, state, high_school, emergency"
765,0,"Instead of showing junk food commercials to kids and show healthier food alternatives instead, emphasizing on making the healthier choice.","school, healthy, food, class, student, job, teach, state, high_school, emergency"
1048,0,the schools need to serve better food to our children so they can develop the good eating habits they will need as adults.,"school, healthy, food, class, student, job, teach, state, high_school, emergency"
1389,0,every kid loves going outside instead of staying in a classroom all day sitting around and working on work that they know they will not put full effort into it,"school, healthy, food, class, student, job, teach, state, high_school, emergency"
619,0,all birth control should be free. $50 dollars a month for a college-student or non college student is alot,"school, healthy, food, class, student, job, teach, state, high_school, emergency"
767,0,"It is safe to say that Almost everyone in the US has access to the internet, either through public libraries, school, or smart phones, so people should do a little research about how to stay healthy not wait on what the government tells them what is healthy and what is not.","school, healthy, food, class, student, job, teach, state, high_school, emergency"
1388,0,"if people hosting them or moderating them were more motivated, students and kids would also be motivated to participate in such events","school, healthy, food, class, student, job, teach, state, high_school, emergency"
771,0,"Maybe make obese concentration camps. Once their BMI gets below obese, they can leave.","school, healthy, food, class, student, job, teach, state, high_school, emergency"
873,0,schools should require flu shots so that there is a less likely chance for it to spread throughout campus,"school, healthy, food, class, student, job, teach, state, high_school, emergency"
1385,0,"since majority of the vegetables at food markets are thrown away because they can no longer be sold at a certain date, they should be donated to schools for the better and not waste food","school, healthy, food, class, student, job, teach, state, high_school, emergency"
1167,0,"Students in high school when taking their fitness tests could be challenged to increase their performance (and thus their fitness) as time goes on, and be provided incentives to do so. Simple things like a free party, or better yet, a day outside could be an award.","school, healthy, food, class, student, job, teach, state, high_school, emergency"
1168,0,"In order to combat diabetes and heart disease, both of which are deadly conditions in America, we could make the fitness community more popular. Youtube and television programs are already gaining popularity with Dr. Oz and amateur youtube stars. If awareness is spread of fitness, more people would be less likely to fall ill to complications like heart disease and diabetes. Appeals to many different types of audiences would need to be tried. For kids, maybe, the focus should be how physical activity can be fun and friendly. For adults, say we focus on the logical health benefits to being fit. And young adults perhaps the aesthetic appeal to being healthy. put the adverts where sedentary people would see them (in video games, at the store, tv, whatever).","school, healthy, food, class, student, job, teach, state, high_school, emergency"
243,0,"Dietary medications is not the way to go for losing weight or to get healthy. So why not take those off the shelves and with that money make it more reductive in another way. As in schools, gyms, people.","school, healthy, food, class, student, job, teach, state, high_school, emergency"
1171,0,The school/teachers could do fundraisers to help with this cost also.,"school, healthy, food, class, student, job, teach, state, high_school, emergency"
1172,0,"They should be required to run one mile every week. On the other days, they could play fun games to keep them from getting burned out and not liking PE anymore.","school, healthy, food, class, student, job, teach, state, high_school, emergency"
1174,0,It should be required every year during junior high and high school instead of just one credit for 3-4 years.,"school, healthy, food, class, student, job, teach, state, high_school, emergency"
1384,0,"schools should feed the students for cheaper fees and also feed them healthier stuff like vegetables instead of majority processed meat that is really unhealthy for everyone, especially kids with weak metabolism","school, healthy, food, class, student, job, teach, state, high_school, emergency"
1176,0,I agree and also events for school wide marathon competition or fitness courses with a variety of awards. Fitness is just as important as education and things like this should be enforced,"school, healthy, food, class, student, job, teach, state, high_school, emergency"
1177,0,"It would be good include more physical activity choices for schools as well, such as different sports, swim team, wrestling, martial arts and others in more school to encourage better fitness and make it fun","school, healthy, food, class, student, job, teach, state, high_school, emergency"
1165,0,Funds should be given to schools to have healthier cafeteria food as well,"school, healthy, food, class, student, job, teach, state, high_school, emergency"
1905,0,try to recruit more teachers for nursing and med programs,"school, healthy, food, class, student, job, teach, state, high_school, emergency"
1842,0,"legalize marijuana to be used as a ""better"" alternative to certain psychiatric drugs","school, healthy, food, class, student, job, teach, state, high_school, emergency"
181,0,"I think putting psychology or the study of the mind that is not biology be put into a required study in high school. During your high school years is when children decide they want to grow up, they start learning more about the outside life and what can happen. During the high school years, we face more problems with bullying of others because they are different. Why not provide a class and teach students about mental illness, because there are minor and major ones to talk about. And let the students be aware that the things they do can trigger something in someone, or you can help someone.","school, healthy, food, class, student, job, teach, state, high_school, emergency"
518,0,"create apps for phones and computers that can accurately track the correct amount of calories you eat and burn throughout the day, not necessarily just calories burned at the gym","school, healthy, food, class, student, job, teach, state, high_school, emergency"
517,0,make gym memberships cheaper and closer to home,"school, healthy, food, class, student, job, teach, state, high_school, emergency"
516,0,require elementary and middle schools to keep their children active in gym activities or at recess,"school, healthy, food, class, student, job, teach, state, high_school, emergency"
251,0,"There's a reason America leads the world in health issues. Maybe it's the ingredients like fructose corn syrup, that can be found in every processed food sold in the market.  America needs to use other countries as examples when it comes to food. Even the most healthiest of choices aren't really all that healthy when you realize all the chemicals that are pumped into the food we eat.","school, healthy, food, class, student, job, teach, state, high_school, emergency"
514,0,also many restaurants should start cutting back on portions size,"school, healthy, food, class, student, job, teach, state, high_school, emergency"
250,0,"I agree with your comment. Dietary medications is there as a fast way to lose weight. It is not the best way, or the most safe way to lose weight either. Its there to the people with the available resources to acquire such medications. Losing weight in gyms or by a diet is considered to be to slow. People fail to realize that losing weight via diet or exercise has many secondary benefits. Benefits you can't achieve by using medications","school, healthy, food, class, student, job, teach, state, high_school, emergency"
507,0,there should emergency centers within 5 miles of any population of people,"school, healthy, food, class, student, job, teach, state, high_school, emergency"
829,0,calorie labels in fast food and restaurant chains should be mandatory so that people will know what they are eating,"school, healthy, food, class, student, job, teach, state, high_school, emergency"
1212,0,"the prices of delivering a baby should be lessened. it's sad that it costs a fortune to be born, a fortune to live, and a fortune to die. since the population will no doubt increase, and HAS been increasing, the price should be lopwered, sine  babies are being born everywhere, everyday, all day.","school, healthy, food, class, student, job, teach, state, high_school, emergency"
851,0,medical school should be cheaper and more scholarships available. professors who teach in medical school should be paid more encouraging them to properly educate the students,"school, healthy, food, class, student, job, teach, state, high_school, emergency"
501,0,"instead of all of the advertisement seen of fast foods, cigarettes, and alcohol, there should be advertisements promoting healthy habits.","school, healthy, food, class, student, job, teach, state, high_school, emergency"
248,0,"In these classes, they could also have some type of parent and student night where the kids tell their parents what they've learned and teach them about eating and living healthy so that the parents are informed as well and see how important it is.","school, healthy, food, class, student, job, teach, state, high_school, emergency"
495,0,"elementary, middle, and high school students should be taught about healthcare, insurance, and medical schools","school, healthy, food, class, student, job, teach, state, high_school, emergency"
234,0,on the education side they could make taking a nutrient class in middle school a requirement so they kids can learn how to eat healthy and what types of food are good for you and that are easy to make.,"school, healthy, food, class, student, job, teach, state, high_school, emergency"
477,0,"Start education of health at younger ages, grade school (elementary up to high school)","school, healthy, food, class, student, job, teach, state, high_school, emergency"
488,0,Food-Banks and Food-drives must provide healthier food for those in need,"school, healthy, food, class, student, job, teach, state, high_school, emergency"
1609,0,"I was with my grandpa at the hospital, and there was an indian intern who came in for respiratory treatements, and I wanted to punch him in the face.","school, healthy, food, class, student, job, teach, state, high_school, emergency"
239,0,"Throughout middle school and high school I had nutritional classes, and like many other elective classes throughout school many students really failed to comprehend, and assess  the severity of the problems we live in these days. Every cause has an effect. I do think classes like that help, but if the student sees their parents eating fast food daily, nutritional classes become useless. Outside influences are very powerful during the adolescent years.  Its important that we pass down healthy lifestyles, from generation to generation.","school, healthy, food, class, student, job, teach, state, high_school, emergency"
1611,0,"If more students were involved in taking job opportunities at PhysScribe Inc, or volunteered at hospitals to assist medical teams, care could be administered to patients more frequently while students did all the small and inattentive details.","school, healthy, food, class, student, job, teach, state, high_school, emergency"
242,0,"America's obesity rate goes up every year by a higher number. Adults already know what to eat and what isn't the best thing, so they should start in schools and make it mandatory for kids to have a nutrients class or something in that category and make the breakfast and lunch menu healthy if it isn't already. Not saying its going to drop the rates but its a start for them to drop.","school, healthy, food, class, student, job, teach, state, high_school, emergency"
470,0,Divert funds to states and let states decide how health care should be administrated,"school, healthy, food, class, student, job, teach, state, high_school, emergency"
454,0,instill more nutritional values in young kids so their foundation is knowledge in healthy eating and lifestyles,"school, healthy, food, class, student, job, teach, state, high_school, emergency"
521,0,"school lunches are horrendous too, make them healthier","school, healthy, food, class, student, job, teach, state, high_school, emergency"
525,0,first for the healthy companies to afford these ads they must sell more product,"school, healthy, food, class, student, job, teach, state, high_school, emergency"
1555,0,"Healthcare should do a better job at foreign health screenings, there are diseases and parasites that used to be extinct in this country that have come back with full force.  For example, tuberculosis was essentially wiped out but has some how become a threat in the U.S. again.","school, healthy, food, class, student, job, teach, state, high_school, emergency"
183,0,"I believe the gist of Obamacare is to utilize preventative care in the U.S. so that people won't be at risk for diseases they could have avoided simply by changing some aspects of their lifestyle. This should definitely be enforced in young students because the earlier you start teaching them about healthy diets and exercise, the more inclined they will be to practice them in reality.","school, healthy, food, class, student, job, teach, state, high_school, emergency"
184,0,Instead of having more schools eliminate recess hour maybe have teachers actually exercise with the kids and do organized games with the kids for 30min.,"school, healthy, food, class, student, job, teach, state, high_school, emergency"
185,0,Instead of having the nasty stuff cafeteria serve have healthy pre-made lunches that are tasty,"school, healthy, food, class, student, job, teach, state, high_school, emergency"
186,0,Have PE teachers teach about healthy food alternatives and have them show them fun ways they can exercise at home,"school, healthy, food, class, student, job, teach, state, high_school, emergency"
187,0,When having the Holiday parties at school instead of the kids bring a lot of junk food have them bring healthy foods and a couple things that are junk food,"school, healthy, food, class, student, job, teach, state, high_school, emergency"
188,0,Have workshops in the school that can help kids be active and think about the healthy alternatives while they are at home or even at school,"school, healthy, food, class, student, job, teach, state, high_school, emergency"
189,0,Schools try to get the parents involved with healthy eating habits so when they get home they could do what they learned with there kids,"school, healthy, food, class, student, job, teach, state, high_school, emergency"
190,0,"When the kids have field day make it a healthy choice day too, so it shows that kids are having fun being active and making healthy choices","school, healthy, food, class, student, job, teach, state, high_school, emergency"
523,0,take steps toward ending childhood obesity,"school, healthy, food, class, student, job, teach, state, high_school, emergency"
558,0,There should be more volunteer opportunities and internship.,"school, healthy, food, class, student, job, teach, state, high_school, emergency"
194,0,Have a TV show for kids and teach them how being healthy can be or then maybe a reverse image.,"school, healthy, food, class, student, job, teach, state, high_school, emergency"
195,0,"This is a good idea but it would be hard on some teachers. Maybe have like sections of classes/a hallway go to outside and play(out side of recess/lunch). Also some kids love recess, and some hate it...","school, healthy, food, class, student, job, teach, state, high_school, emergency"
196,0,Maybe having state ladders for healthy families and where they rank for life style/food choices etc... I know I'm naturally competitive and it could spark some to take another step onto a healthy path. The question would be how to make it competitive without the effect of feeling bullied if your at the lower end or behind someone.,"school, healthy, food, class, student, job, teach, state, high_school, emergency"
259,0,Doctors could start making house calls again.,"school, healthy, food, class, student, job, teach, state, high_school, emergency"
802,0,Emergency services have been very pro-active during the Boston Marathon bombings and Waco Fertilizer explosion.,"school, healthy, food, class, student, job, teach, state, high_school, emergency"
860,0,they should change the high school curriculum so that its more beneficial for students after graduation,"school, healthy, food, class, student, job, teach, state, high_school, emergency"
1351,0,everyone must join a armed force department.,"school, healthy, food, class, student, job, teach, state, high_school, emergency"
856,0,"More useful everyday skills should be requirements to be taught in school. (Budgeting, balancing checkbooks, automotive, how to apply for jobs, writing resumes/cover letters, insurance, self-medical care, etc.)","school, healthy, food, class, student, job, teach, state, high_school, emergency"
1347,0,School control lunches hurt healthy kids.,"school, healthy, food, class, student, job, teach, state, high_school, emergency"
193,0,An advertise program that has celebrities/professional sport players eating/drinking health food/drinks. Everyone takes in to consideration be it negative or positive about the ad and when they are shopping.,"school, healthy, food, class, student, job, teach, state, high_school, emergency"
1052,0,"children should get more exercise at school instead of sitting in there desks for most of the day, they only get 15 minutes outside after lunch and then they are confined to there desks. we keep saying that obesity is a problem with the youth its because they don't get to move around for most of the day. its hard to get them to go outside after being trapped inside all day because they then have a tone of homework to do. they should have PE every day and a longer recesses. it has been shone that children who get to run around in the middle of the day perform better on test and all around in school because they have gotten to clear there heads and run out some of the energy they have that was keeping them from focusing","school, healthy, food, class, student, job, teach, state, high_school, emergency"
