Line_Number,Dominant_Topic_Number,Sentences,Keywords_In_Dominant_Topic
72,2,"Money could be a reason why for both. There should be a better investment for healthcare. No money means no pay which makes for a poor satisfaction and poor care to patients, and not enough people to operate the emergency rooms.","doctor, patient, money, hospital, pay, time, not, nurse, company, make"
1929,2,have secretarial staff in the waiting room medically trained to an extent to where they can offer some aid to those with less urgency compared to those who are in more dire situations who are taken into the ER right away,"doctor, patient, money, hospital, pay, time, not, nurse, company, make"
1069,2,A good way to improve the healthcare system is   to let specialized computers help doctors diagnose patients. This will save the time and money for the patient as well as receiving better treatment.,"doctor, patient, money, hospital, pay, time, not, nurse, company, make"
66,2,"I don't think that having a pharmacy and physician together will really make that much of a difference. there are more important things than making it ""convenient"" for the patient so they don't have to drive to a pharmacy. I'd rather have a more fit physician and pharmacist instead.","doctor, patient, money, hospital, pay, time, not, nurse, company, make"
1147,2,Having more doctors available could help this so that they have the time to really assess a patient instead of running around trying to get to everybody.,"doctor, patient, money, hospital, pay, time, not, nurse, company, make"
1939,2,"if a patient's doctor is retiring within half a year (or withing an X amount of time), then the doctor should let them know asap and help his patient with finding a doctor they are comfortable/suitable with","doctor, patient, money, hospital, pay, time, not, nurse, company, make"
970,2,"everyone needs a clinic that is nearby. sometimes, people with emergencies don't have enough time to make it to the ER.","doctor, patient, money, hospital, pay, time, not, nurse, company, make"
1431,2,A paid internship wouldn't be bad either not only are you gaining experience and interacting with patients but you are getting paid to do something that is of interest to you and that you have a passion for.,"doctor, patient, money, hospital, pay, time, not, nurse, company, make"
1229,2,"Hospitals seem to be discriminative when it comes to who to help first. Since America consists of many Hispanics, more Hispanic nurses and doctors should be hired.","doctor, patient, money, hospital, pay, time, not, nurse, company, make"
1756,2,we pay a lot of money for doctors. The availability of them should increase.,"doctor, patient, money, hospital, pay, time, not, nurse, company, make"
1246,2,A visitation to the emergency room costs so much even if there is nothing really wrong with you. I went to the emergency room because i got stung by a wasp and i am deathly allergic. The doctors told me that taking benedryl right after i get stung will make my swelling go down. We paid over $100 for a doctor to tell me to take a medication that most people have in their homes already.,"doctor, patient, money, hospital, pay, time, not, nurse, company, make"
314,2,Instead of loosing territory to new Wal-Mart's we should use that territory to build new hospitals or clinics.,"doctor, patient, money, hospital, pay, time, not, nurse, company, make"
941,2,"there should be regulations on the amount a doctor can charge a patient for how many tests they are given for diagnosis. and if in the end the patient did not need the test, they should not be charged for it","doctor, patient, money, hospital, pay, time, not, nurse, company, make"
283,2,i think the same that hospitals should worry less about the architecture of their building unless they are accommodating on the number of rooms for patients rather than the style or appearance of the place to save money on decorations and spend it on equipment,"doctor, patient, money, hospital, pay, time, not, nurse, company, make"
282,2,"definitely yes, you are paying good money for your dear old loved one to be taken care of and payed attention to, so that is the obvious reason they are in there in the first place because some families only have time to visit not enough time to check on their meds and health 24/7","doctor, patient, money, hospital, pay, time, not, nurse, company, make"
299,2,I've always thought this should be put in place. The only problem I could see would be that maybe taxes would have to be raised so that the doctors and nurses would still make money to live on.,"doctor, patient, money, hospital, pay, time, not, nurse, company, make"
280,2,they should make insurance plans affordable to anyone and everyone because this is a reason why hospitals are constantly backed up. Because not everyone can afford to pay a doctor.,"doctor, patient, money, hospital, pay, time, not, nurse, company, make"
960,2,doctors should not be influenced by outside sources such as politics and industrial companies,"doctor, patient, money, hospital, pay, time, not, nurse, company, make"
1251,2,"if the hospital bill is going to continue to be high, check ups should be free and the pharmaceuticals should be much cheaper.","doctor, patient, money, hospital, pay, time, not, nurse, company, make"
323,2,there should be like programs for poor people who can apply to get help in paying for the medical bills.,"doctor, patient, money, hospital, pay, time, not, nurse, company, make"
277,2,"By all means if you have the money to get at the front of the line, well they better pay double so that money can circulate and it can be used for other medical expenses.","doctor, patient, money, hospital, pay, time, not, nurse, company, make"
324,2,"Basically, everything revolves around money so they should think first about how to distribute money.","doctor, patient, money, hospital, pay, time, not, nurse, company, make"
325,2,The workers of the hospitals should be friendly and reliable because many of them dont smile and it does really hurt the reputation of the hospitals.,"doctor, patient, money, hospital, pay, time, not, nurse, company, make"
1235,2,"America needs to model it's healthcare after the Swiss. End of story. Take the precautions, take the time, but do it.","doctor, patient, money, hospital, pay, time, not, nurse, company, make"
326,2,There should also be diversity in workers because it might be easier for patients to interact more with workers that are from same place. Increase diversity.,"doctor, patient, money, hospital, pay, time, not, nurse, company, make"
1234,2,"It is 2013, and we're still being told in the Diagnosis Centers, ""we don't know what is wrong"". More money needs to be allotted to health research, because there are more than a few industries that could use a cut.","doctor, patient, money, hospital, pay, time, not, nurse, company, make"
946,2,emergency rooms should be treated as emergencies and doctors and nurses should be properly staffed to quickly and efficiently care for these patients instead of making them wait for hours while the staff does paperwork,"doctor, patient, money, hospital, pay, time, not, nurse, company, make"
1759,2,"I know some do that, but most don't, should they be forced, or maybe get nurses on their as well.","doctor, patient, money, hospital, pay, time, not, nurse, company, make"
286,2,"Hospitals are going paperless so heavy use of technology such as flat screens, table cart computers, bar codes, and tablets are really helping the physicians to retrieve the patients' medical records faster.","doctor, patient, money, hospital, pay, time, not, nurse, company, make"
1760,2,"The cost of the techology should be helped, and reduced. one reason why healthcare is so expensive is that the machines that could save our lives, costs the hospitals millions of dollars, which in turn causes them to raise their cost to treat a patient.","doctor, patient, money, hospital, pay, time, not, nurse, company, make"
301,2,they do this already. The medicine cannot be widely distributed if it has major side affects that make the patient worse.,"doctor, patient, money, hospital, pay, time, not, nurse, company, make"
297,2,The pharmacist should explain to the patients thoroughly about the medications like when to take it and with what or the side-effects of the medications.,"doctor, patient, money, hospital, pay, time, not, nurse, company, make"
1228,2,"This is true. If healthcare was free, doctors and nurses may get paid less and therefore, America would have an even higher demand for nurses and doctors. Many doctors may quit because the income may be cut.","doctor, patient, money, hospital, pay, time, not, nurse, company, make"
1242,2,"The patients whom are in commas on life support, can not pay for there care, but its up to there love ones and when they cant pay, what happens to them. the doctors have little clue when or if they will ever wake up. and a lot of times some give up hope and pull the plug.","doctor, patient, money, hospital, pay, time, not, nurse, company, make"
1769,2,"yes this is true, nurses tend to have years of knowledge and prep for this kind of work","doctor, patient, money, hospital, pay, time, not, nurse, company, make"
1770,2,"More medical professional training. With the competitive and limited nature of nursing school, it becomes discouraging for those interested. If more and more nursing schools appeared, there would be more medical professionals as it pertains to nursing which would increase the volume. At the same time, that would cost more for people to stay, but with the principles of supply and demand, the more people that come in the hospital (not run away from the long emergency room lines) the less we'd have to pay for healthcare.","doctor, patient, money, hospital, pay, time, not, nurse, company, make"
1245,2,"This is very true. Most families can't afford to have the patient laying in a bed for the possibility that their loved one may live, so they just tell the doctors to pull the plug. It should not cost so much for a person to lay in a bed.. only the treatment should be charged","doctor, patient, money, hospital, pay, time, not, nurse, company, make"
292,2,The doctors should be able to interact with the patients easily.,"doctor, patient, money, hospital, pay, time, not, nurse, company, make"
1784,2,Keep doctors from always getting sued.,"doctor, patient, money, hospital, pay, time, not, nurse, company, make"
948,2,health staff should not be told about a patient's salary or insurance level because it may interfere with their bed side manner,"doctor, patient, money, hospital, pay, time, not, nurse, company, make"
947,2,the staff should get less pay instead of more pay for making patients wait. the government should make it mandatory that treatment be given even if insurance paperwork has not gone through (yet). money can be worried about later especially if its less expensive,"doctor, patient, money, hospital, pay, time, not, nurse, company, make"
1761,2,"I also say give more responsibilties to nurses. Let them take control sometimes, just as long as their properly trained. I know most nurses with an MBA can pretty much do everything doctors can do, except prescribe medicine.","doctor, patient, money, hospital, pay, time, not, nurse, company, make"
307,2,"They should hire more doctors, that way everyone has an equal opportunity to be attended by one","doctor, patient, money, hospital, pay, time, not, nurse, company, make"
1240,2,who pays for the patients in the mental institutions? themselves? Us or is the government paying to keep them secure?,"doctor, patient, money, hospital, pay, time, not, nurse, company, make"
1774,2,"We need to push more Nurse practitioners/Physician assistants before we push cheaper medical school. That is just how it is. Nurse practitioners do almost as much as a doctor would, yet it costs less to the hospital. The military healthcare system is shifting more towards to NP/PA route rather than doctors just due to the cost factor. It's cheaper to the hospital yet the NP/PA's get PAID.","doctor, patient, money, hospital, pay, time, not, nurse, company, make"
308,2,Nurses should be required to know as much as a doctor that way they can be more useful whenever a doctor is not there.,"doctor, patient, money, hospital, pay, time, not, nurse, company, make"
1775,2,"Doctors really don't get paid as much as you'd think. Their salary is paying off their tuition for grad/med school as well as all the different types of insurance to cover them. On top of that, if they have a private practice, they have to pay for staffing and leasing the building and bill just on that- thus the reason they partner up. Eventually their salary pays off. But you get paid for the amount of work you put in. 12 years of school, you worked hard for that money so why strip it away? That's why it's not for everyone. If it were easy, everyone would be doing it.","doctor, patient, money, hospital, pay, time, not, nurse, company, make"
1776,2,"Educationally wise, we need to push more nurse practitioners and physician's assistance.","doctor, patient, money, hospital, pay, time, not, nurse, company, make"
1772,2,Nurses to me already have a workload on them. They have a lot going on as it is. They do more in the sense that they're a caretaker. Doctors diagnose and such.,"doctor, patient, money, hospital, pay, time, not, nurse, company, make"
1252,2,"there should be a personality requirement for doctors and nurses. Difficult to upset, easy to calm. Optimistic and very caring. Willing to help others without being watched. Things of that nature. Nurses and doctors seem to be getting more and more cruel every year.","doctor, patient, money, hospital, pay, time, not, nurse, company, make"
1250,2,Nursing home costs should be lower and the treatment should be better. Older people need to be treated gently and with care. i have visited a nursing home where the patient is not talked to and just left to lay in a bed the whole day. This should be changed.,"doctor, patient, money, hospital, pay, time, not, nurse, company, make"
936,2,insurance should not be forced on everyone if it is going to put them out of work or lessen their hours because it'll only harm them in the long run with less money and no insurance.,"doctor, patient, money, hospital, pay, time, not, nurse, company, make"
1740,2,the cost of visiting a doctor should be reduced. Office visit fees should either be taken off or reduced.,"doctor, patient, money, hospital, pay, time, not, nurse, company, make"
931,2,doctors should charge the same price for a doctors visit,"doctor, patient, money, hospital, pay, time, not, nurse, company, make"
1741,2,"after seeing a doctor for your medical issues, there should be a onling 24-7 chat with either a doctor or a nurse. Or at least some sort of email so that the doctor can respond right away.","doctor, patient, money, hospital, pay, time, not, nurse, company, make"
272,2,"Hospitals should spend less on the look of the hospital, but more on how their services are given equal to their patients.","doctor, patient, money, hospital, pay, time, not, nurse, company, make"
1746,2,"cost of emergency room bills shouldnt be 14,000 for just 1 day! thats ridicoulous.","doctor, patient, money, hospital, pay, time, not, nurse, company, make"
963,2,more clinics should be opened throughout communities to prevent unnecessary expensive emergency room visits,"doctor, patient, money, hospital, pay, time, not, nurse, company, make"
1230,2,"part of the incentive to becoming a doctor is the high pay. the whole flow of income needs to be rethought so that we can still pay our doctors their fair share, while being able to give everyone who needs healthcare their share as well.","doctor, patient, money, hospital, pay, time, not, nurse, company, make"
1743,2,Doctors should follow up not with only visits but also phone calls as some cannot afford a follow up visit.,"doctor, patient, money, hospital, pay, time, not, nurse, company, make"
937,2,"drug companies should not be competing with each other to sell more product, if the medicine is the same it shouldn't be marketed as different medications","doctor, patient, money, hospital, pay, time, not, nurse, company, make"
334,2,quit spending money on putting mcdonalds on every corner of every street too.,"doctor, patient, money, hospital, pay, time, not, nurse, company, make"
1161,3,"Healthcare could be cheaper for full-time employees, and it could also be offered to part-time employees for a different cost per visit or as necessary. A lot of part-time jobs don't offer a healthcare provider for their part-time employees; A lot of part-time employees are students at a university who need healthcare benefits also.","people, healthcare, health, care, insurance, make, not, system, government, cost"
1287,3,"People should be taught better on proper nutrition. We KNOW obesity is an issue, we KNOW not to eat greasy, oily, sugary foods, but I don't think some people understand how badly this really affects your body not just in terms of making you ""fat"" but also how it affects your organs, heart, mind, etc.","people, healthcare, health, care, insurance, make, not, system, government, cost"
1286,3,That way people pay according to their income. Like 2% let's say gets put into this account monthly,"people, healthcare, health, care, insurance, make, not, system, government, cost"
1162,3,"That would be good, or to at least put the individual on probation or have an increase percentage of monthly pay for health insurance","people, healthcare, health, care, insurance, make, not, system, government, cost"
1255,3,"It's so easy for people to say that we should have free healthcare or something along those lines, but it's unfair to the doctors/nurses/etc. to just provide free service especially if they get paid less because of all of the money and time and effort they've spent getting to that point.","people, healthcare, health, care, insurance, make, not, system, government, cost"
1120,3,Or the amount that could be saved could be placed into a private retirement account.,"people, healthcare, health, care, insurance, make, not, system, government, cost"
1390,3,and also our immune system gets weaker as we grow older,"people, healthcare, health, care, insurance, make, not, system, government, cost"
1394,3,"Although the government can somehow help us in ways if we cannot afford, we should not ALWAYS rely on government.The government is already in enough debt.","people, healthcare, health, care, insurance, make, not, system, government, cost"
1391,3,"only if they give out unhealthy and inedible food, which they shouldnt be doing to them","people, healthcare, health, care, insurance, make, not, system, government, cost"
1121,3,Students should be required to take more credits of physical education and health to be better educated about their bodies.,"people, healthcare, health, care, insurance, make, not, system, government, cost"
1122,3,Children should have more recess time.,"people, healthcare, health, care, insurance, make, not, system, government, cost"
1393,3,Americans should be well informed and updated with what is going on,"people, healthcare, health, care, insurance, make, not, system, government, cost"
1288,3,The technology have been improving drastically,"people, healthcare, health, care, insurance, make, not, system, government, cost"
1392,3,Children should be more informed about the health at an early age to prevent from any conditions that could lead u;p to it.,"people, healthcare, health, care, insurance, make, not, system, government, cost"
1160,3,They should at least get free or reduced annual check ups.,"people, healthcare, health, care, insurance, make, not, system, government, cost"
1124,3,"Health care professionals should be on a rating system nationwide to ensure professionalism when dealing with patients. This could be online, like a ""ratemyprofessor"" type system which rates on several aspects of the professional. This way patients can look up their doctors online before choosing them, and automatically the standard for quality care will increase because of demand.","people, healthcare, health, care, insurance, make, not, system, government, cost"
1265,3,The Ambulances should be free and covered by the government same as police departments and fire departments.,"people, healthcare, health, care, insurance, make, not, system, government, cost"
1264,3,I agree. Older people should be qualified to pay a range of nothing to about 2% of the medical expenses.,"people, healthcare, health, care, insurance, make, not, system, government, cost"
1408,3,Little things matter in life.,"people, healthcare, health, care, insurance, make, not, system, government, cost"
1117,3,"Free/reduced screenings for things (breast cancer, prostate cancer, etc.) should be more greatly communicated so that a majority of the surrounding population would be aware of it and take advantage of the opportunity.","people, healthcare, health, care, insurance, make, not, system, government, cost"
1256,3,"Mental health and mental health facilities should be more looked into. I doubt many people know how treatment is at those facilities. It is often overlooked in the healthcare field because when people hear the word ""healthcare"" they just think of your typical hospitals with the ER and whatnot.","people, healthcare, health, care, insurance, make, not, system, government, cost"
1383,3,"if obesity is the cause for the terrible service, fees, and non benefits for health care then just make food products free to those who can not afford it at all that has a full family with at least one person in the household working","people, healthcare, health, care, insurance, make, not, system, government, cost"
1178,3,Maybe even offer free workout programs on YouTube. (Things that resemble Insanity or P90x but doesn't cost anything.),"people, healthcare, health, care, insurance, make, not, system, government, cost"
1175,3,"This will give them more time to ""play"" and work off the food they just ate.","people, healthcare, health, care, insurance, make, not, system, government, cost"
1173,3,"Agreed. Some factors like good driving record, good background check, and a healthy weight could be awarded with cheaper/reduced health care.","people, healthcare, health, care, insurance, make, not, system, government, cost"
1244,3,cancer treatment should definitely not be withheld and given only to those who can afford the extremely rediculous amount of money it costs to be treated.,"people, healthcare, health, care, insurance, make, not, system, government, cost"
1429,3,"insurance should cover all surgeries if the surgeries are necessary/mandatory. i know that getting your tonsils out isn't covered by insurance because they find it isn't necessary, but for some cases it may be. they shouldn't be able to put a general NO to surgeries, it should be decided individually for each case.","people, healthcare, health, care, insurance, make, not, system, government, cost"
1113,3,"Raising the quality of medicine and care should be our top priority. Doctors should praise  not by the amount of  patients they treat, but the quality of healthcare they give to the patient. Most doctors today get paid regardless on how well they treat you. This should be reformed!","people, healthcare, health, care, insurance, make, not, system, government, cost"
1170,3,They could also be rewarded with homework passes or test bonus points.,"people, healthcare, health, care, insurance, make, not, system, government, cost"
1290,3,I think the health education is great. The years and experience needed to be in Health Care helps make the overall health care great for the people that are in need.,"people, healthcare, health, care, insurance, make, not, system, government, cost"
1119,3,"When determining eligibility for government health insurance, other factors should be considered instead of just income and amount of children.","people, healthcare, health, care, insurance, make, not, system, government, cost"
1260,3,the ER is just a tad too expensive. The cost is supposed to make the common cold and cuts go to a clinic and leave the ER to the emergency. But its also too expensive to make someone who might have serious problem stay at home and wait to sees if it goes away.,"people, healthcare, health, care, insurance, make, not, system, government, cost"
1427,3,i feel that mental health should be tested when getting and renewing your drivers license or any kind of state issued ID,"people, healthcare, health, care, insurance, make, not, system, government, cost"
1262,3,ER should be limited to people with a serious life threatening condition or a serious injury. A lot of people now days are in long lines for the ER room due to the lack of identifying what is serious and what is not.,"people, healthcare, health, care, insurance, make, not, system, government, cost"
1289,3,The Health Care system first choice should not be pharmaceuticals unless the remedies and holistic way does not fully work on patients.,"people, healthcare, health, care, insurance, make, not, system, government, cost"
1164,3,"I agree with the fact that children should be given more times for physical activities, so an extra health class along with P.E and recess should help","people, healthcare, health, care, insurance, make, not, system, government, cost"
1263,3,"Yes I agree with this. Our ERs are too expensive even though you don't show a serious injury , or you need a minimum help. The cost must be reduced, and help should be provided right away.","people, healthcare, health, care, insurance, make, not, system, government, cost"
