Line_Number,Dominant_Topic_Number,Sentences,Keywords_In_Dominant_Topic
275,3,Depending on how severe someone is hurt then they should be skipped to the front of the line. If they medical attention that you need is not as an emergency then you should be willing to let others get treated first.,"people, healthcare, health, care, insurance, make, not, system, government, cost"
274,3,"Unless everyone agrees to put on the effort to make healthcare for everyone, well then everyone should have access to it. But if they do not then they have the right to exclude them from it.","people, healthcare, health, care, insurance, make, not, system, government, cost"
273,3,Improve waiting lines for sick patients.,"people, healthcare, health, care, insurance, make, not, system, government, cost"
271,3,Using the prototype healthcare of another county could help the US with the framework of a new healthcare system. Possibly making it better and more efficient all citizens.,"people, healthcare, health, care, insurance, make, not, system, government, cost"
269,3,Emergency room services should be at an equal service to all patients.,"people, healthcare, health, care, insurance, make, not, system, government, cost"
285,3,equal rights for sure across the board and across stratification levels in society,"people, healthcare, health, care, insurance, make, not, system, government, cost"
305,3,"The healthcare system should be taught in high school, like in government or something.","people, healthcare, health, care, insurance, make, not, system, government, cost"
222,3,"While I do believe health care should be cheaper for the average joe. I don't believe healthcare should be force onto people who don't need it, or simply just don't want it. I feel that it's a waste of money. I also think it break our constitutional rights.","people, healthcare, health, care, insurance, make, not, system, government, cost"
220,3,"We Americans rely to much on pharmaceuticals. I believe we should have tighter regulations on the drugs that can be prescribed by doctors, and over the counter medicines. I say this because there are many examples of patients becoming dependent on these drugs leading to other health care related issues.","people, healthcare, health, care, insurance, make, not, system, government, cost"
165,3,Educate about the differences in mental illness and what types of mental illness there is. Many people assume that while schizophrenia is a mental illness but not ADHD (Attention Deficit Hyperactivity Disorder) is not.,"people, healthcare, health, care, insurance, make, not, system, government, cost"
164,3,Maybe provide therapy or counseling for parents or family members help deal with a loved one with mental illness so they are aware of what they can do to provide everything they need for their loved one.,"people, healthcare, health, care, insurance, make, not, system, government, cost"
163,3,"The health care system was built around helping your neighbor in a sense. In a group of ten people, one person might get six so the other 9 people would pay for a safety net if you will. One of the major problems is that our system doesn't account for a population boom, i.e. ""Baby-Boomers"". There are ways we can band aid the situation or make a temporary fix as in increasing the restrictions. This would restrict the health care given though, but it would give quality care to the ones that really need it. There are a lot of possibilities to ""band-aid"" the situation. However, to major fix the system we would have to get me details about the cost expenditures of the Healthcare system and it's sub-section. The current place we are at now is exhausting resources thus we are already restricting the health care system by this. The long term fix is going to come from preventative care i.e. technology and education. If we restrict the current health care system for awhile, there is no easy fix. Then we could make grants for study for colleges or firms to research the diseases, recovery rate, etc... This would give the incentive to invent new techniques to pre-screen patients for ailments then categories the patients in there system which could reduce the emergency room wait time. Another way is to spread out the load on the system thus you would need other places for the traffic to go. However this can be more costly because of upkeep cost and it would take time to build, but the long term effect is having clinics that can serve for the minor emergencies or non life threatening emergencies. The problem with this though is the people would have to know what the two are and how they are different. An example if your getting robbed you call 911, if you hear shots fired you call 911, but if you lose your wallet do you call 911? Thus, you would need education. Education would help reduce the work load through people going to where they are suppose to go for a given emergency, not to mention them themselves eating healthier, treating themselves better, etc...","people, healthcare, health, care, insurance, make, not, system, government, cost"
162,3,"Educating the young in middle and high school with actual programs to expand upon the potential risks of smoking, sex, and other health concerns could be very beneficial if funding went to having a good program set forth.","people, healthcare, health, care, insurance, make, not, system, government, cost"
161,3,"The Health Care System right now is forcing too much upon the people and businesses as well. The main concern shouldn't be making every single person in American pay for every service that most will not use just so that a few can take advantage of it. The main concern should focus on helping the lower class who needs the services, obtain the standard of living that can provide them. Instead of throwing billions of tax dollars into food stamps and welfare checks, focus that money into creating the mass amounts of jobs that encourage the poor to get back on their feet, rather than giving to them handouts that encourage laying down.","people, healthcare, health, care, insurance, make, not, system, government, cost"
160,3,"That sounds fine, however you cant tell an insurance company that they're ""not allowed"" to turn down anyone for any reason because the business would crash, and even if they're not allowed to turn down a customer because of health reasons, they'll just claim that the reason they turned them down was because of financial background, career, etc. If the government wants to have insurance company that doesn't turn people down because of health conditions, then they might as well set it up themselves. However, that federal dollar funded organization will probably suffer a significant loss in $$ similar to the US Postal Service.","people, healthcare, health, care, insurance, make, not, system, government, cost"
159,3,"Unless the person has a rare, or very severe problem, local Wal-marts, CVS pharmacy, or Walgreen's stores already provide very inexpensive generic medicines (both on the shelf and over the counter) with no insurance needed. However the biggest issue I see when it comes to medicine, is the big companies who patent their medicine when it's the only quality cure for a particular health problem. I'm usually not a person for government stepping into a business' business, but when that one company can charge ridiculous prices just because they're the only seller, there is a problem.","people, healthcare, health, care, insurance, make, not, system, government, cost"
156,3,"Universal healthcare should be provided to only those who pay their taxes. As for the people who don't, there should be cheap alternatives that may not provide the same quality of care but get the job done.","people, healthcare, health, care, insurance, make, not, system, government, cost"
153,3,Research ways in detecting people who have a mental disorder early in the stage and treat them right away. This could prevent a lot of tragedies from happening.,"people, healthcare, health, care, insurance, make, not, system, government, cost"
152,3,Increase taxes and use that money to provide universal healthcare,"people, healthcare, health, care, insurance, make, not, system, government, cost"
166,3,"Provide more options for the lower class, middle class, and upper class to balance out what they can make out of what they have.","people, healthcare, health, care, insurance, make, not, system, government, cost"
151,3,Do not just let the schools offer one aspect on safe sex make them talk about all the options,"people, healthcare, health, care, insurance, make, not, system, government, cost"
148,3,Make it to were everybody can afford insurance,"people, healthcare, health, care, insurance, make, not, system, government, cost"
147,3,Maybe making medicine cheaper for people who have no insurance,"people, healthcare, health, care, insurance, make, not, system, government, cost"
145,3,Having people who have dealt with family members or children with mental health problems educate parents who might have just found out about it,"people, healthcare, health, care, insurance, make, not, system, government, cost"
143,3,The government can set aside funding for research for incurable diseases,"people, healthcare, health, care, insurance, make, not, system, government, cost"
142,3,Educate people on the different types of insurance,"people, healthcare, health, care, insurance, make, not, system, government, cost"
141,3,Stop letting health care providers reject you just because you might be in bad health before getting a health care provider,"people, healthcare, health, care, insurance, make, not, system, government, cost"
140,3,Offering people with no insurance more places to go if an emergency occurred,"people, healthcare, health, care, insurance, make, not, system, government, cost"
139,3,Instead of having doctors volunteer at the facilities and clinics that except no insurance why not pay doctors for there services still so maybe they will care more about the people they see that can not get insurance,"people, healthcare, health, care, insurance, make, not, system, government, cost"
137,3,Start educating children from a younger age then just having a one semester health class in high school.,"people, healthcare, health, care, insurance, make, not, system, government, cost"
136,3,Better technology provided in smaller clinics,"people, healthcare, health, care, insurance, make, not, system, government, cost"
150,3,Get educators for health to go around schools and teach kids and educate kids more if needed,"people, healthcare, health, care, insurance, make, not, system, government, cost"
221,3,"Adding to your point, I believe one of the biggest weapons we have against America's health system in general is exercise. All of the studies in the area of exercise have the benefits greatly out-weighting the risk. I believe America needs to stop leaning on pharmaceuticals, as a solution. Exercise is shown to be a tool against prevention of bad health,  and when one becomes ill exercise is also shown that exercise will help the body recover.","people, healthcare, health, care, insurance, make, not, system, government, cost"
168,3,Provide a day care in more high schools now that there are higher risks of teen pregnancies.,"people, healthcare, health, care, insurance, make, not, system, government, cost"
173,3,"The government has so many ways for people to freeload off of the benefits they provide. For instance, welfare checks for the unemployed and food stamps for people who don't make enough money to feed their family. Yes, these projects are important but we spend too much of our tax dollars funding them. The focus should be on healthcare because it is ridiculous, especially now, how much money people have to spend to receive treatment. Universal healthcare is definitely something that the government should look into and invest money in.","people, healthcare, health, care, insurance, make, not, system, government, cost"
218,3,This money should be put towards education for healthcare so that the quality and technology can continue to increase.,"people, healthcare, health, care, insurance, make, not, system, government, cost"
217,3,"I think if health care was free, the quality of it would decrease.","people, healthcare, health, care, insurance, make, not, system, government, cost"
216,3,I think everyone should have to pay the same amount. I don't think people should have to pay more just because they make more money.,"people, healthcare, health, care, insurance, make, not, system, government, cost"
214,3,There should be a maximum on how much a health care provider can charge a person because it would not hurt the health care providers to take a salary decrease,"people, healthcare, health, care, insurance, make, not, system, government, cost"
213,3,"instead of spending tax payers dollars on trying to prevent obesity that money could be better spent somewhere else. For those people who decide to be obese should have to pay for their own actions. They are adults an should be responsible for what they eat and drink, the government should not have to spend money on telling you not to eat fast food everyday or to exercise","people, healthcare, health, care, insurance, make, not, system, government, cost"
211,3,"They should try a system where the amount you pay for health care should be determined by how many times you visit a doctor, with exceptions to the people who are chronically ill like patients with cancer","people, healthcare, health, care, insurance, make, not, system, government, cost"
210,3,What would be a reasonable percentage to take out for health care?,"people, healthcare, health, care, insurance, make, not, system, government, cost"
209,3,It seems like everyone wants cheap cost but no one wants cheap care. The reason health care is expensive is so we can have the best care available.,"people, healthcare, health, care, insurance, make, not, system, government, cost"
207,3,What kinds of requirements should these emergency rooms have?,"people, healthcare, health, care, insurance, make, not, system, government, cost"
206,3,But are our physicians just as good-quality as Canadian physicians? Is it quantity over quality? Free is convenient but you also have to think are you getting the best treatment possible?,"people, healthcare, health, care, insurance, make, not, system, government, cost"
172,3,Also maybe put healthcare as a requirement for schools to teach the kids so kids could get an understanding on all aspects on how the healthcare works,"people, healthcare, health, care, insurance, make, not, system, government, cost"
205,3,"I believe health care should be a little more affordable. The cost of living is already going up but the cost of staying alive shouldn't go up as well. Like taxes, the government takes out a percentage based on what the person makes, the cost of health care should be the same way. Because everyone makes different amounts of income the cost of health care should cost accordingly.","people, healthcare, health, care, insurance, make, not, system, government, cost"
203,3,How is school and health care related?,"people, healthcare, health, care, insurance, make, not, system, government, cost"
201,3,The education shouldn't be messed with but the cost should go down since the school is already hard to get into ; which is a good thing; they cost should shorten.,"people, healthcare, health, care, insurance, make, not, system, government, cost"
200,3,Insurance should come in different levels sort of like today but different. The first level is free for everyone and the next levels you would have today. The free package will still be treated as to the other packages. With the free package you still would get great service and quality. In the other packages the differences will be your family can stay all together as one health insurance verses your child leaving when they are 19.,"people, healthcare, health, care, insurance, make, not, system, government, cost"
197,3,In Canada they have free health care since we know its possible i think we should aim for that.,"people, healthcare, health, care, insurance, make, not, system, government, cost"
192,3,In grocery store have them show the healthy alternatives of the items they buy,"people, healthcare, health, care, insurance, make, not, system, government, cost"
191,3,Making healthy foods more accessible instead of having one aisle in a grocery store or driving to whole foods that's too far away for some people,"people, healthcare, health, care, insurance, make, not, system, government, cost"
182,3,I think it should be easily accessible at any age. Especially to young children who have serious or even menial health problems.,"people, healthcare, health, care, insurance, make, not, system, government, cost"
178,3,"The benefits or welfare checks are supposed to be in effect for the person receiving it for certain amount of years, I think that's a max of 5 years to be in the program. I do think it should be harder for it to gain those benefits or put more guidelines and rules to keep getting welfare.","people, healthcare, health, care, insurance, make, not, system, government, cost"
176,3,"True story, a man that couldn't afford an operation that was life threatening decided to do a crime(i think rob), he got arrested pleaded guilty and upon entering the criminal system was able to get his life saving operation. Also, I don't think universal healthcare would work in any way shape or form. It's good in a sense but if you put into practice, let's say Canada... Good luck not waiting for 8 months. (overreacting of course.)","people, healthcare, health, care, insurance, make, not, system, government, cost"
175,3,Limiting the covered operations of a given program.,"people, healthcare, health, care, insurance, make, not, system, government, cost"
204,3,What kind of levels should they have? Since you already have explained they are similar to the ones we already have today?,"people, healthcare, health, care, insurance, make, not, system, government, cost"
604,3,That's why you would have colors to identify which case is more serious and you would use a number system to identify each patient. It would be the same as when they call out your name to take you back to your room,"people, healthcare, health, care, insurance, make, not, system, government, cost"
570,3,"There needs to be better budgets in place and money raising ideas for funding of the technology, rather than denial because funding for technology is not available.","people, healthcare, health, care, insurance, make, not, system, government, cost"
1981,3,"On the same issue, many times it is people of different ethnicity that are shy or fearful to approach people government official, this should be addressed.","people, healthcare, health, care, insurance, make, not, system, government, cost"
883,3,prescriptions are sometimes too expensive and some people cannot afford them,"people, healthcare, health, care, insurance, make, not, system, government, cost"
881,3,Some people do not know what their insurance covers so it is important that everyone should learn about it,"people, healthcare, health, care, insurance, make, not, system, government, cost"
1047,3,I agree! Preventive care is the best care.,"people, healthcare, health, care, insurance, make, not, system, government, cost"
878,3,we should not increase medicare because people on medicare depend too much on it.,"people, healthcare, health, care, insurance, make, not, system, government, cost"
877,3,parents should be more responsible for the well being of their child. this means that they should have their children eat healthier foods and exercise daily to prevent being obese,"people, healthcare, health, care, insurance, make, not, system, government, cost"
1051,3,"I understand your logic, it's not the kids fault, but the woman who is smoking knows this will happen because smokers have higher insurance anyways, just like people who engage in other risky behaviors.","people, healthcare, health, care, insurance, make, not, system, government, cost"
1053,3,"I think that everyone who wants or needs healthcare should have the option, but it shouldn't be forced upon them.","people, healthcare, health, care, insurance, make, not, system, government, cost"
876,3,universal healthcare would mean that we would have to pay more taxes,"people, healthcare, health, care, insurance, make, not, system, government, cost"
874,3,hand sanitizer dispensers available everywhere so the public can have easy access to them.,"people, healthcare, health, care, insurance, make, not, system, government, cost"
871,3,people who work should have more benefits than those who don't,"people, healthcare, health, care, insurance, make, not, system, government, cost"
1054,3,"I agree, children are the future population. If our children start off down the wrong road it could possibly change, but then it could get worse. But if they start down the right road with health education, there are no drawbacks.","people, healthcare, health, care, insurance, make, not, system, government, cost"
868,3,and somehow provide education on health care because there's hundreds of people who don't know anything about health care,"people, healthcare, health, care, insurance, make, not, system, government, cost"
866,3,"anybody working with people, regardless if it's in a nursing home, hospital, doctor's office, etc., should make sure that that is what they truly want to do.  it is unfortunate that at times the people that you depend on to take care of a loved one, or even yourself, do not even like what they do, totally hate their job, and might even mistreat the patients.  what's the point of making good money while working in a place which does not suit you?","people, healthcare, health, care, insurance, make, not, system, government, cost"
865,3,"if anyone is sick, whether they have insurance or not, they should be able and have the right to receive emergency room services","people, healthcare, health, care, insurance, make, not, system, government, cost"
1058,3,"Healthcare providers should be given, without request, a day or so off to take a break from the work environment. The reason I say they should be given is b/c some HC providers will probably deny to take a day off. Sometimes, that is all a person needs in order to get back on track.","people, healthcare, health, care, insurance, make, not, system, government, cost"
861,3,"That would be great, it would be a win-win situation for the students because they get to practice and build more confidence in what they're doing, and the patients can benefit from receiving a service at a much lower cost than what is normally paid.","people, healthcare, health, care, insurance, make, not, system, government, cost"
859,3,everyone should receive some type of education some how on health care because I have no idea what it's about either,"people, healthcare, health, care, insurance, make, not, system, government, cost"
1060,3,Not everyone knows how to take proper care of their child when it is a new experience. Illnesses and other things among them can be prevented and avoided if caregivers of the child were educated and informed on what to do if certain situations were to arise.,"people, healthcare, health, care, insurance, make, not, system, government, cost"
855,3,"nor a helicopter, you can't help that you're in critical condition","people, healthcare, health, care, insurance, make, not, system, government, cost"
884,3,surgeries can cost up to hundreds of thousands of dollars and no average middle class American has that kind of money.,"people, healthcare, health, care, insurance, make, not, system, government, cost"
854,3,health care plans should be taught in high school. i have no idea about any aspect of it,"people, healthcare, health, care, insurance, make, not, system, government, cost"
885,3,"if people maintain a healthy diet and exercise on a daily basis, then there would be no need for extra medications","people, healthcare, health, care, insurance, make, not, system, government, cost"
888,3,"the American health care system is too expensive and people should be able to afford it and everyone should have a right to receive health care, it's like $100 more in the US than other countries such as France, Canada, and Spain.","people, healthcare, health, care, insurance, make, not, system, government, cost"
909,3,patients should be informed of what their health care plan covers,"people, healthcare, health, care, insurance, make, not, system, government, cost"
908,3,children should be taught more on how to eat healthy and how it is going to benefit your health,"people, healthcare, health, care, insurance, make, not, system, government, cost"
907,3,some hospitals give care that is unnecessary for patients and therefore will make their hospital bill higher,"people, healthcare, health, care, insurance, make, not, system, government, cost"
906,3,Yes!,"people, healthcare, health, care, insurance, make, not, system, government, cost"
1040,3,Personal health lifestyles should be majorly emphasized to everyone! I personally believe it should be taught at BIRTH! Prevention is essential to have a less expensive health toll in the future.,"people, healthcare, health, care, insurance, make, not, system, government, cost"
1041,3,the insurance companies should not charge the elder more for there premiums just because they are old.,"people, healthcare, health, care, insurance, make, not, system, government, cost"
1042,3,"Insurances should not charge more for a child of a women who is considered ""high"" risk for cancer. They jack the prices up because of the mom and that should not happen the child may never have any problems.","people, healthcare, health, care, insurance, make, not, system, government, cost"
