Line_Number,Dominant_Topic_Number,Sentences,Keywords_In_Dominant_Topic
1541,3,"This should be put in the same pot as social security, and if paid for by these individuals over the span of their life, that will in the future cover their cost. Why should they be turned down if others, some not even legal in this country can receive it? This is asinine, our seniors who have paid in and worked hard, lose it all and have it given to people who have never worked a day in their life? Reform programs such as welfare and food stamps, then we can have more money to work with and begin talks on matter such as healthcare reform","people, healthcare, health, care, insurance, make, not, system, government, cost"
1540,3,This is very true. companies and the government make it more expensive to eat healthy,"people, healthcare, health, care, insurance, make, not, system, government, cost"
1539,3,The Healthcare industry should start focusing more on the younger generation because of the increasing stat in childhood obesity. Cardiovascular disease is the leading cause of death in the United States.,"people, healthcare, health, care, insurance, make, not, system, government, cost"
1537,3,I couldn't agree more but the root of the problem to this whole discussion is money. its not possible to get everyone the perfect healthcare plan.,"people, healthcare, health, care, insurance, make, not, system, government, cost"
1536,3,"But this is a fallacy, that everything in the world, if equal, would work best. But as history has shown, when something grows to large and can no longer be controlled, it always collapses in on itself. Why decrease our healthcare benefits which have been worked for and earned by my forefathers, and give them to someone else who maybe has not earned them, or due to circumstance and bad luck has never received them. I look out my family and nation before any other, and taking away some benefits from myself and my family and giving them to others who have no right to them is just wrong, at least without my consent.","people, healthcare, health, care, insurance, make, not, system, government, cost"
1535,3,"I agree. if I agree. i work at a health club and insurance companies actually cover the membership costs for their members. There are age requirements for these types of programs. If the Government can give better tax breaks to these insurance companies, it could help with directing the spending towards getting our youth into health clubs and a more active lifestyle.","people, healthcare, health, care, insurance, make, not, system, government, cost"
1546,3,i know their are some benefits that healthcare companies offer if you live a healthy lifestyle. i think maybe our health insurance providers could offer some more incentives to a healthy lifestyle. maybe cheaper premiums and different kind of rewards.,"people, healthcare, health, care, insurance, make, not, system, government, cost"
1534,3,"There is no bias in repsonse times, it depends on the circumstance, if you live 30 miles from a hospital and or fire station, it will take longer to receive medical attention than if you lived just 5 miles away.","people, healthcare, health, care, insurance, make, not, system, government, cost"
1532,3,"We are living in the time period of globalization. Today, nobody can really say what home is. If the number of sick people is going to be decreased then there also going to be advantages in the U.S. The society should create a global healthcare network on all continents.","people, healthcare, health, care, insurance, make, not, system, government, cost"
1531,3,The society should get more informed of current sicknesses in their districts.,"people, healthcare, health, care, insurance, make, not, system, government, cost"
1530,3,Every person has the same rights. Everybody deserves perfect healthcare until his last heartbeat.,"people, healthcare, health, care, insurance, make, not, system, government, cost"
1529,3,"The healthcare system should look how healthcare systems in other countries working. In Germany is a health insurance mandatory and this is right. Life is not predictable and every day something bad can happen to everybody. Because of this, the U.S needs a mandatory health insurance. This insurance should cover everyday problems like sports injuries or financial support for people with eyes disabilities. For people who want to be covered better is still the opportunity to pay more and get more.","people, healthcare, health, care, insurance, make, not, system, government, cost"
1528,3,Healthcare should be focused on everybody. There should not be a specific age boarder. Everybody is created equal so everybody deserves equal healthcare.,"people, healthcare, health, care, insurance, make, not, system, government, cost"
1527,3,A basic health insurance should be mandatory for every citizen. Every citizen should have the right to be checked by a doctor and to get help when he or she needs it. The heritage and the financial income can not be problems to get a health insurance for every citizen.,"people, healthcare, health, care, insurance, make, not, system, government, cost"
1526,3,The government should increase the requirements to pass physical education classes instead of allowing children to become so doughy.  I don't think providing a rope or a jungle gym is that expensive.,"people, healthcare, health, care, insurance, make, not, system, government, cost"
1525,3,The age to enter into medicare should be increased due the fact that people are living longer.  The average lifespan for a human is no longer 72 but 83.  Also this will stop companies from dropping their employees from group coverage as soon.,"people, healthcare, health, care, insurance, make, not, system, government, cost"
1522,3,Healthcare should be more focused on the young.,"people, healthcare, health, care, insurance, make, not, system, government, cost"
1533,3,"A global healthcare network should be established to help for example foreigners during vacation in other countries. In addition, all healthcare documents on earth should be written in the same language and should be in the same form.","people, healthcare, health, care, insurance, make, not, system, government, cost"
1521,3,Vaccinations should be more readily available to the public.,"people, healthcare, health, care, insurance, make, not, system, government, cost"
1547,3,Termination of other social assistance programs to fund a help care plan for those who are lower income?,"people, healthcare, health, care, insurance, make, not, system, government, cost"
1549,3,Yeah unfortunately the biggest preventive STEP that we could take is in our food. There are so many loopholes in regulations though that we are still eating poison.,"people, healthcare, health, care, insurance, make, not, system, government, cost"
1576,3,"This showed the hypocrisy of our current system, do as I say not as i do. This double standard is wrong, that certain individuals because of status can opt out of a mandatory program, while others are forced to stay in, or are fined for not doing so. Why not make everyone participate, it is only fair.","people, healthcare, health, care, insurance, make, not, system, government, cost"
1575,3,Health insurences should be available for everybody and cover every health disability except body/beauty makeovers.,"people, healthcare, health, care, insurance, make, not, system, government, cost"
1574,3,This is the point we can not be afraid of people or work that people do who actually want to help us. If this opinion would occur at more and more people we would live in a sick society and the doctors would become unemployed.,"people, healthcare, health, care, insurance, make, not, system, government, cost"
1573,3,What if for people to get the health care they wanted but could not afford it they had to pay by community service for a government job. This would allow the govt to cut back on jobs which means less salaries to pay but then allows patients to get better care. Of course this sounds simplistic but the jobs could accomModate based on disability or whatever and is open to any kind of adjustment. At the end of the day spending has to be cut somewhere in order to provide more affordable healthcare or debt ceiling is just raised and the dollar crashes faster.,"people, healthcare, health, care, insurance, make, not, system, government, cost"
1571,3,You're right... I have a bad knee and bad shoulder but I can't afford to go to a doctor. But the last thing I want is to get a hand out. This health care stuff sucks... theres no solution,"people, healthcare, health, care, insurance, make, not, system, government, cost"
1570,3,Thinking with your heart - won't get you anywhere in business as so with coming up with a financially responsible healthcare plan that is just.,"people, healthcare, health, care, insurance, make, not, system, government, cost"
1569,3,"Yes but it is to big of a cost to try and help everyone. Natural selection should be considered here. We cant save everyone, especially when those being saved will not have a high quality of life if kept alive.","people, healthcare, health, care, insurance, make, not, system, government, cost"
1568,3,"This will always be a problem. also Europe has cameras on almost every street corner. That is why crime and violent acts are so uncommon. I personally think that our country should really consider doing the same. Going back to health Insurance. If we dedicate more time to research on new and improved drugs for people with ""mental illness"", we're taking away time and money away from the leading cause of death here in the U.S., which is cardiovascular disease. This disease is one of the main reasons why our healthcare has become such a problem.","people, healthcare, health, care, insurance, make, not, system, government, cost"
1567,3,"why should we buy into this new healthcare system if congress is not? Obama was asked the question ""will you and your family adopt this new healthcare plan""? He danced around the question and did not answer. Other members of congress were asked the same question and they said they will ""think about it""","people, healthcare, health, care, insurance, make, not, system, government, cost"
1548,3,I can say what home is... I live here in Arlington. I've lived in Dallas my whole life. I have a good understanding of where home is for me. I know several other people who would say the same.,"people, healthcare, health, care, insurance, make, not, system, government, cost"
1566,3,"the only thing with that is, more money would have to come out of our pockets","people, healthcare, health, care, insurance, make, not, system, government, cost"
1564,3,Another big problem is foreigners that are benefiting from free health care that American citizens are paying for. i understand they want to come here for a better life but we have to come up with some plan that forces them to contribute. too many people are looking for handouts now a days or expect someone to help bail them out of their situation,"people, healthcare, health, care, insurance, make, not, system, government, cost"
1561,3,you never know what can happen and every person who is on this earth deserves help. Also every kind of this people can develop the medicine by trying new things when the patient agrees,"people, healthcare, health, care, insurance, make, not, system, government, cost"
1559,3,"Less government short of Anarchy is what our goal should be here. Understandably there should be standards set, education of physicians and medical personnel, medications, so on and so forth. But to the point in which the government wants to compete, and directly effect the healthcare system? This is where it has gone to far. Forcing every American to buy insurance, lying by saying that the penalties of not doing so is a tax. You can read the health care plan after it is passed???? This is terrifying, that the average American will stand for this, and reelect the same individuals responsible, and their excuse, "" Well at least they are trying"". 40% of americans are on some form of government assistance, and the president keeps saying that things are getting better, and more and more americans are out of work, many illegals receive free healthcare, while not paying taxes. Many americans receive benefits while sitting on their -----, and not contributing in their lifetimes while everyone else has to. As said by a famous scholar, every democracy will die, once its people realize that they can elect themselves benefits, or as we may know it ""freebees"". There should be no discussion past regulations.","people, healthcare, health, care, insurance, make, not, system, government, cost"
1558,3,"I concur, screenings for anyone who is coming into our nation from foreign zones, or places which do not have the same standards of healthcare as our own. This may seem unfair, but we cannot have our own get sick and die because someone was mad that they had to go through additional screenings before entering. Coming over into the US is not a right, but a privilege unless you are a US citizen. We owe nothing to anyone else, and likewise for others owing anything to us.","people, healthcare, health, care, insurance, make, not, system, government, cost"
1112,3,Most Americans who are not covered are young adults in college. This is because health insurance can be too expensive even at the minimum coverage plan. I propose that young adults should be covered under their parent's insurance until the age of 25. This should not raised the price high on the parents because people in this age group tend to be healthier.,"people, healthcare, health, care, insurance, make, not, system, government, cost"
1557,3,"I agree, i too know what home is. A global healthcare system at this time will never work. Our own nation is having a hard time with keeping the post office open, let alone a new healthcare system which has already been passed. Programs such as the UN fail left and right, showing no new signs of progress in making strides in fields such as medicine. In helping these nations the west is falling, the west being the backbone to all of this. If the west falls, everything falls.","people, healthcare, health, care, insurance, make, not, system, government, cost"
1556,3,Healthcare is nearly impossible to maintain with the high number of individuals in the world today.,"people, healthcare, health, care, insurance, make, not, system, government, cost"
1552,3,Maybe the government should look into a way of funding eastern type medicines. There are so many stories of people being healed by going that route.,"people, healthcare, health, care, insurance, make, not, system, government, cost"
1551,3,"I honestly believe there is no good answer to this healthcare problem. The way this looks is, no matter what someone has to pay the price for someone else to be healthy or not sick. There doesn't seem to be a good solution.","people, healthcare, health, care, insurance, make, not, system, government, cost"
1565,3,Healthcare should be treated like buying a car. you may want a 2013 Camaro but don't have the down payment or the credit score. a car dealership isn't going to give you a handout. You have to settle for something less or what you can afford or account for.,"people, healthcare, health, care, insurance, make, not, system, government, cost"
1520,3,Healthcare should be focused more on it's own country more than on others.  Charity starts at home.,"people, healthcare, health, care, insurance, make, not, system, government, cost"
1519,3,Healthcare should also be focused on helping everyone and not just the vast majority.  Not all medications work for everyone.,"people, healthcare, health, care, insurance, make, not, system, government, cost"
1518,3,Physical education should also be improved because lack of funding towards it is another reason why people are contracting things such as high blood pressure and diabetes at younger ages.,"people, healthcare, health, care, insurance, make, not, system, government, cost"
1466,3,Additional healthcare cost for people with undiagnosed/untreated depression could be reduced,"people, healthcare, health, care, insurance, make, not, system, government, cost"
1465,3,Mental health has to be more of a priority at the most basic levels of healthcare because of it's impact on general health and well being,"people, healthcare, health, care, insurance, make, not, system, government, cost"
1464,3,"Eventhough specialist have spent more on education, the difference in what they make & what the GP makes for seeing more of the population is unreasonable.  I don't believe in price fixing either by the gov't or insurance companies, but there has to be some way to bring their incomes more in line","people, healthcare, health, care, insurance, make, not, system, government, cost"
1461,3,"The move from large metropolitan hospitals to smaller regional facilities is a move in the right direction because it provides more access, higher quality, and is more cost effective","people, healthcare, health, care, insurance, make, not, system, government, cost"
1460,3,The way it is now the people on either end (poor & wealthy) have the most government assistance,"people, healthcare, health, care, insurance, make, not, system, government, cost"
1459,3,Insurance companies should be better regulated and not making such outrages profits for what little they do to make healthcare better,"people, healthcare, health, care, insurance, make, not, system, government, cost"
1457,3,companies should be incouraged to self insure their employee through government inscentives.  This should also make them for competative by attracting more & better employees,"people, healthcare, health, care, insurance, make, not, system, government, cost"
1456,3,People who can afford it (the wealthy) should be incouraged to self insure,"people, healthcare, health, care, insurance, make, not, system, government, cost"
1454,3,Americans should be able to use the healthcare provider of their choice to improve the quality by keeping it competative,"people, healthcare, health, care, insurance, make, not, system, government, cost"
1468,3,should send papers home to be read over and signed before arriving the day of surgery.,"people, healthcare, health, care, insurance, make, not, system, government, cost"
1453,3,The government should offer a basic healthcare coverage policy to all Americans regardless of employment or income level.,"people, healthcare, health, care, insurance, make, not, system, government, cost"
1451,3,Drugs that are safe should be made OTC sooner to lower the cost,"people, healthcare, health, care, insurance, make, not, system, government, cost"
1448,3,I agree. You cant rule out surgeries you think arent eligible for coverage.,"people, healthcare, health, care, insurance, make, not, system, government, cost"
1445,3,"I agree. All health care should also be equal price, no matter if you have different medical insurances.","people, healthcare, health, care, insurance, make, not, system, government, cost"
1444,3,I think that also having up-to-date equipment is necessary and training doctors how to properly use them is a good idea. Most equipment doctors use are out-of-date and sometimes they encounter problems with the equipment.,"people, healthcare, health, care, insurance, make, not, system, government, cost"
1443,3,"I completely agree, if the word isnt spread about such programs then their benefit wont be taken. Advertising more programs wouldnt be a bad idea.","people, healthcare, health, care, insurance, make, not, system, government, cost"
1441,3,"I agree. they probably go to seminars with other doctors worldwide and get their updated information through there. And if they don't, they should make up seminars for these doctors to go to.","people, healthcare, health, care, insurance, make, not, system, government, cost"
1440,3,government programs such as Care Now are available to everyone. These programs should be more advertised so people can go and seek medical attention. And if there problem is severe the people that work for care now should find the nearest and cheapest doctor to see their problem.,"people, healthcare, health, care, insurance, make, not, system, government, cost"
1439,3,Everyone should have the same health care to cover medical needs. Just the financial aid depends on your income and other expenses you pay. People should have the same oppurtunity in receiving health care needs.,"people, healthcare, health, care, insurance, make, not, system, government, cost"
1436,3,"True enough especially knowing a lot of people like to drive under the influence of either drugs or alcohol. A mental health screening wouldn't be such a bad idea not only categorizing drugs or alcohol but you never know by getting that mental health screen there can be something so minor or major you wasn't aware of and you can go to the doctor or hospital to get that special need taking care of for instance pregnancy, skin disease, chicken pox, or even diabetics that didn't know you had and is diagnosed with diabetes.","people, healthcare, health, care, insurance, make, not, system, government, cost"
1452,3,"Doctor's malpractice costs should be capped, both by limiting court judgements and insurance premiums, to lower healthcare costs","people, healthcare, health, care, insurance, make, not, system, government, cost"
1470,3,"we cant punish those who make more money, wanting what they have should be a reason to work harder and i think pushes some people to achieve better things for themselves in life.","people, healthcare, health, care, insurance, make, not, system, government, cost"
1475,3,"Medical bills are very expensive especially doing with the different surgeries you can possibly have some people can make their full payments on the other hand, you have to think about people that aren't able to pay in full surgeries should be exempt from payments in my own opinion like heart surgery some hospitals may allow it depending on the circumstance and some may not. Payment plans is also an option like stated before there are a lot of people that can not afford to pay in full and those that are well off can and should pay in full.","people, healthcare, health, care, insurance, make, not, system, government, cost"
1478,3,"I would personally feel intimidated, because of such location, and I would also feel that the workplace would not be taken as serious as it should be if there were a floor dedicated to exercising.","people, healthcare, health, care, insurance, make, not, system, government, cost"
1517,3,I think that pharmaceutical companies should allow more drugs that can cure diseases to go under clinical trials than worrying about the fact that cures do not make money.,"people, healthcare, health, care, insurance, make, not, system, government, cost"
1516,3,Preventative care should be the main focus of healthcare.  It is easier to prevent someone from contracting a disease than to try to cure one.,"people, healthcare, health, care, insurance, make, not, system, government, cost"
1515,3,"What if government were to take a big part of the budget towards healthcare and apply it to promoting/helping organic agricultural busniess. The biggest problem in americais due to what we are eating. We're not diseased because our conditions are bad, but because our food is not whole.","people, healthcare, health, care, insurance, make, not, system, government, cost"
1514,3,If you think about it... why waste money on people that are really close to death.,"people, healthcare, health, care, insurance, make, not, system, government, cost"
1513,3,free emergency healthcare should not be made available to patients 85 and older,"people, healthcare, health, care, insurance, make, not, system, government, cost"
1512,3,Government should give taxbreaks to insurance companies that are willing to cover costs of chiropractic care and other modes of medicine/health .,"people, healthcare, health, care, insurance, make, not, system, government, cost"
1508,3,"I don't believe much money should be spent on those with mental disabilities. Although research is good and maybe we can find ways to prevent peoples mental conditions, how much help are we really to those people and how much are they a help to society? I think if government and tax payers are going to spend money they should spend money on people who will be of some profit to society.","people, healthcare, health, care, insurance, make, not, system, government, cost"
1507,3,I think there should be tax breaks for physicians who find actual cures for low income patients with health problems. For example if a physician can get a diabetes 2 patient off of meds (although it is not curable) to where the patient has been educated and has their disease under control or managed- government should give physicians tax breaks on this because it would cost government less to pay for a low income persons meds.,"people, healthcare, health, care, insurance, make, not, system, government, cost"
1506,3,"Providing easily accessable, inexpensive services at the most basic levels and making the public aware of the availability seems key to reducing costs for more severe, expensive services later on.","people, healthcare, health, care, insurance, make, not, system, government, cost"
1504,3,There would have to be an incentive because insurance companies most likely would not want to cover such Rx eventhough it would be to there advantage saving payments for more costly procedures later on.,"people, healthcare, health, care, insurance, make, not, system, government, cost"
